question,answer
What is AI?,Artificial Intelligence is the simulation of human intelligence by machines.
What is Machine Learning?,Machine Learning is a subset of AI that allows systems to learn automatically.
What is Python?,Python is a popular programming language used in AI and web development.
Who developed Python?,Python was developed by Guido van Rossum.
What is NLP?,NLP stands for Natural Language Processing.
What is OpenCV?,OpenCV is a computer vision library.
What is Deep Learning?,Deep Learning is a branch of machine learning using neural networks.